date;retweets;text
2016-06-25;1;"DOW components $ DJI , now only 10 stocks trade above $100 $ MMM $ IBM $ GS $ UNH $ BA $ HD $ MCD $ JNJ $ TRV $ CVX pic.twitter.com/UxRwqNCMa4"
2016-06-25;0;"Complacency, no panic selling $ SPY $ SPX $ QQQ $ DJI $ NYA pic.twitter.com/XglaK4RiCg"
2016-06-25;1;"Equity Put/Call ratio spikes, maybe too late ? $ SPX $ SPY $ NYA $ QQQ $ DJI pic.twitter.com/DweNXlgFQz"
2016-06-25;0;"An overview of Friday's stock market action - $ FINL $ GS $ DJI http://www. fool.com/investing/2016 /06/24/what-happened-in-the-stock-market-today.aspx …"
2016-06-25;0;"Brexit Shocks The World! http:// clicky.me/873o $ WFT $ DJI #Brexit #NigelFarage pic.twitter.com/ns9dqk1nlw"