date;retweets;text
2020-02-15;0;"FALSE NEGATIVE IS POSSIBLE FOR UP TO 24 DAYS AND IS COMMON IN FIRST TWO WEEKS... $ SPX $ NDX $ RTY $ DJI $ TRAN $ VIX https:// twitter.com/IrrTr/status/1 228786641117908992 …"
2020-02-15;0;"Liquidity Warning: Fed Shrinks Overnight Repos By $20BN, Term Repos By $10BN | Zero Hedge $ SPX $ DJI $ RTY $ NDX $ TRAN https://www. zerohedge.com/markets/liquid ity-warning-fed-shrinks-overnight-repos-20bn-term-repos-10bn …"
2020-02-15;0;"$ SPY $ NLOK $ SPY $ MSFT $ CGC $ TLRY $ BYND $ AMZN $ DJI $ COMP $ SPX https:// twitter.com/HopskotchT/sta tus/1228557528901939200 …"
2020-02-15;0;"Stock Trends $ DJI Bullish Crossover Portfolio report, February 14, 2020 $ IBM $ MSFT $ AAPL http:// ow.ly/ny9s50ynnXN pic.twitter.com/onIXMjMJGE"
2020-02-15;0;"Por si te resulta util, en breve tambien para $ DJI #DJIA . pic.twitter.com/e4qKYB2yDq"
2020-02-15;0;"The Secret to Fun and Easy Stock Market Riches #beware $ DJI http:// bit.ly/3bDnepH"
2020-02-15;2;"What happened today in the #StockMarket ? Performance of sectors, #FAANGs ( $ AAPL $ AMZN $ GOOG $ NFLX $ FB ), top indices ( $ SPX $ NDX $ DJI ) and related components. https://www. bulldude.com/daily-stock-ma rket-summary-february-14/ … $ EXPE $ NVDA $ PAYC $ ILMN $ KHC $ V"
2020-02-15;0;"Weekly $ DJI Going UP 800 to Break up 30k OR DOWN 2000 - #DJI TradingView https://www. tradingview.com/chart/DJI/Eq1q yvi1-Weekly-DJI-Going-UP-800-to-Break-up-30k-OR-DOWN-2000/ …"
2020-02-15;2;"Friday Recap: HUGE week with lots of volatility in the price action due to virus concerns and earnings season. $ SPY $ NLOK $ SPY $ MSFT $ CGC $ TLRY $ BYND $ AMZN $ DJI $ COMP $ SPX @MDLive4 pic.twitter.com/jzFgay0JBX"