date;retweets;text
2017-03-11;0;"Sign in to this week's Masterminds webinar on global markets FREE! #Dow #Gold #Bonds #FOREX #Oil http:// bit.ly/2fYg5lM"
2017-03-11;0;"A Lot Has To Go Right For The #Market #Rally To Continue. #Dow http:// association-financial.advisor.news/a-lot-has-to-g o-right-for-the-market-rally-to-continue/?c=eyJ0eXAiOiJKV1QiLCJhbGciOiJIUzI1NiJ9.eyJwcmV2aWV3IjpmYWxzZSwibm9kZV9pZCI6OTQwLCJjb21tX2lkIjoxMDQ0NTQsImRlc3RfaWQiOjEwNjg5N30.u60gbd6MdvizneGoN9WGcawoZ8eRfyYM3D_V2Hvwzek … pic.twitter.com/evLEf6dKPQ"
2017-03-11;0;"BOB HOYE Interview $ INDU $ WTIC Positive US Employment & the #Dow #Crude , #Commodities and the 50 day trading average http://www. institutionaladvisors.com/whats-new/bob- hoye-interview3974410 …"
2017-03-11;1;"Check out the list of the 10 Highest Paying #Dividend #Stocks in the #Dow http:// chc.li/2m3jyTO #investing $ KO $ VZ $ IBM $ CAT $ BA pic.twitter.com/7S6MVDBurG"
2017-03-11;1;"@paulazibasa eröffnet das #Finale . #LINES #schneefräsn #GlemmRide @saalbach_com #Snow #Dow … http:// ift.tt/2mwqv16 pic.twitter.com/9Ck2Qgd9MT"
2017-03-11;2;"#ogm #monsanto #Dow #DuPont conflits d'intérêt , études payées par Monsanto and co @Robin_Mesnage @LouiseVandelac @corinnelepage https:// twitter.com/IsabelleChivil o/status/840642757467242499 …"
2017-03-11;0;"The #Dow of contemporary #Jones market our lifestyle w/ shared public indexes of wearable #hair . © dmp 2017 @SalonSaturday @BlackHAIRSalons pic.twitter.com/LMv2CTYsu2"
2017-03-11;2;"Un rapport sur l'absence de danger des OGM financé par Monsanto https://www. rts.ch/info/sciences- tech/environnement/8451374-un-rapport-sur-l-absence-de-danger-des-ogm-finance-par-monsanto.html … #ogm #monsanto #Dow #DuPont #fraudescientifique"
2017-03-11;0;"Dogs of the Dow versus the S&P400 Mid-Cap https:// tradingsim.com/blog/dogs-of-t he-dow-versus-sp400-mid-cap/ … #dow #tradingsim #investing #sp400 #spmidcap #trading"
2017-03-11;0;"He has strongest tax breaks #Brazosportisd #Job oportunities 602 #Investors #Freeport LNG #Dow #Basf #1 @Houston Business Journal pic.twitter.com/qt7RFnUiy4"
2017-03-11;0;"Boas pessoal trago-vos mais um vídeo, desta vez um vídeo de Days of War. Espero que gostem !!! #dow http:// youtu.be/tQfs952pCoA?a"
2017-03-11;0;"#DJIA #Dow Price fell out of blue fork body but found support & bounced on EMA13. Lower blue tyne now resistance. pic.twitter.com/imx9DBqSHb"
2017-03-11;1;"No sleep til Breckinridge @brettnmccoy @AlexGuariento @FullTorqueBondr #dow #rog #shulman #randomdowfriend"
2017-03-11;0;"Now Trade #Bitcoin #AMAZON #APPLE #PAYPAL #DAX #CAC40 #NASDAQ #dow #ftse #cfd #indices #index #commodities #trader … http:// fxmgm.com"
2017-03-11;0;"Trump travel ban: Judge declines to reinstate ruling #All Finance #United States #Dow Jones 30 https://www. dukascopy.com/refpro/in.php? aHR0cHM6Ly93d3cuZHVrYXNjb3B5LmNvbS9meHNwaWRlci9tLzQ4OTIyMjAxNjMwNjQ2NjM3MzQvP3V0bV9zb3VyY2U9dHdpdHRlciZ1dG1fbWVkaXVtPXNvY2lhbCZ1dG1fY2FtcGFpZ249ZnhzcGlkZXIlMjB0d2l0dGVyJTIwcG9zdGluZwpzcHAtdHctU3BpZEVO …"
2017-03-11;0;"Wir leiten das Wochenende mit einem Rückblick ein. Runde Marken sind unterschritten im #dax und #dow nun Spannung zur US-Notenbanksitzung pic.twitter.com/rsu5QJwuEX"
2017-03-11;0;"PAMELA v0.1.0.18 http:// kraky.games/pc/download/pa mela-v0-1-0-18 … #Action #Adventure #Daily #DEVO #EarlyAccess #Indie #Update #Dow"