date;retweets;text
2017-04-29;1;"Dow breaks out of triangle a\u2026 $ DJI http://www. tradingview.com/chart/DJI/4cI8 A8D9-Dow-breaks-out-of-triangle-and-bounces-off-100-day-MA/ …"
2017-04-29;2;"$ DJI monthly for some entertainment RSI seems to breaking out as well. got a lot to do. #trading #stocks pic.twitter.com/X1DL7eb1TW"
2017-04-29;2;"Dow Jones Die neuen Ziele. Sie denken, dass ist unmöglich. Wir werden es sehen $ NDX & $ COMP , $ SPX & $ DJI #TaxCut #Healthcare #Gridlock pic.twitter.com/jJeJs9UJJR"
2017-04-29;1;"Time for a stall? Although $ NDX & $ COMP are at highs, $ SPX & $ DJI hit the wall at top of range. Blocked by #TaxCut #Healthcare #Gridlock pic.twitter.com/hTo9jvAL4u"
2017-04-29;0;"Dow breaks out of triangle a\u2026 $ DJI http://www. tradingview.com/chart/DJI/4cI8 A8D9-Dow-breaks-out-of-triangle-and-bounces-off-100-day-MA/ … TV_TradingIdeas"