date;retweets;text
2018-05-26;0;"Crypto so flat its making the $ SPX $ DJI look volatile. and those markets aren't even open rn Pretty much only trading bitcoin these days because its i can do it on weekends."
2018-05-26;2;"Don't forget to study your market #cheatsheet ! Learn more and join FREE at http:// wingtrades.com $ SPY $ DJI $ DJIA $ AMZN $ AAPL $ MSFT $ SPY $ DJI $ JPM $ WFC $ BAC $ AMZN $ AAPL $ SQ $ MU $ SPX $ DJI $ FB $ GOOGL $ FB $ MSFT $ VZ $ HD $ JPM $ BAC $ WFC $ PM $ PG $ GE $ NCASH $ ADA $ ONT $ AST $ NGTF $ DCR pic.twitter.com/plyTnPKEbA"
2018-05-26;0;"Let's Gamble on the Dow! $ DJI http://www. tradingview.com/chart/DJI/beKG J93q-Let-s-Gamble-on-the-Dow/ …"
2018-05-26;0;"DJI - Has a Probable Short Top (at least) $ DJI http://www. tradingview.com/chart/DJI/39hp SMea-DJI-Has-a-Probable-Short-Top-at-least/ …"
2018-05-26;0;"Hmm. A longterm imbalance has produced another similar Negative Divergence for the $ INDU $ DJI $ DJIA & #DOW just as it did back in 2007! $ SPX $ RUT $ NDX $ NQ $ QQQ $ EEM $ YM $ RTY $ ES $ AAPL #GOLD $ GLD $ NUGT $ CL @MarketWatch @WSJmarkets @CNBC @CNBCFastMoney @TruthGundlach pic.twitter.com/540Fw5DDHG"
2018-05-26;0;"Dow short $ DJI http://www. tradingview.com/chart/DJI/MEFJ wixN-Dow-short/ …"
2018-05-26;0;"Stock Trends $ DJI Portfolio report, May 25, 2018 #algorithmic #trading #systematic #investing #stockmarket #stocks http:// ow.ly/ZZWf30kcdbo pic.twitter.com/zZJ8AslyEf"
2018-05-26;0;"Insiders must have left for the weekend... $ SPX $ NDX $ DJI pic.twitter.com/bLmi5hmy9b"
2018-05-26;1;"Squeeze is on for $ BA !!! Next target is much higher and is posted in members room. Join us and get winning trade plan after winning trade plan! http://www. classic-options.net $ SPY $ SPX $ DJI $ IWM $ AAPL $ NVDA $ BABA pic.twitter.com/DW7y8Dgr74"