date;retweets;text
2019-12-01;1;"Wintry Weather Boosts OnLine Christmas Shopping as Mall-Shopping Fades No Turkeys -Stocks Fly Help Wanted Why Renting is In #breakingnews @realdonaldtrump #cybermonday #blackfriday #stocks #dow #millennials #realestate #mortgage http://www. linkedin.com/pulse/giserman -group-news-week-ahead-merry-online-shopping-lou/?trackingId=WbZbZe3TTjyOph1NWmPFgw%3D%3D …"
2019-12-01;0;"Valores en seguimiento para la próxima semana en nuestros canales de Telegram Apoya y accede http:// patreon.com/retinversor #trading #NASDAQ #NYSE #USA #WallStreet #DOW #DowJones #SP500 #Nasdaq pic.twitter.com/9c2YrpX63p"
2019-12-01;1;"Eurusd analizi şu anda telegram sinyal kanalımız da #fx #forex #forexsignals #fxsinyal #para #money #forextrader #freesignal #dax #usdtry #eurusd #gbp #xauusd #jpy #dow #nasdaq #wti #brent #sell #buy pic.twitter.com/LUOpuSipGs"
2019-12-01;0;"Strong NYSE Composite, Dow Jones May Give Bitcoin a Boost Into 2020... https:// cryptosrocket.com/news/2019/12/0 1/strong-nyse-composite-dow-jones-may-give-bitcoin-a-boost-into-2020/ … #bitcoin #dow #nyse"
2019-12-01;1;"Grupta herhangi bir pariteden analiz istediğinizde size yardımcı olmaya çalışacam. Gruptaki çalışmalar tamamen ücretsiz olacak. #fx #forex #forexsignals #fxsinyal #para #money #forextrader #freesignal #dax #usdtry #eurusd #gbp #xauusd #jpy #dow #nasdaq #wti #brent #sell #buy"
2019-12-01;0;"JFD #Trading Wochenanalyse KW49/2019 - #DAX - #EUR / #USD - #DOW - GOLD $ Gold http:// gmtr.ly/SFYOnu-U"
2019-12-01;0;"Thank you to the #DOW family I hope to get back to my stream schedule once I figure how I am going to get back into it but big plans going into 2020 and remember age is just a number and more experience in this world! I will get smarter and work even harder!"
2019-12-01;0;"$ DOW enters a Downtrend as Momentum Indicator dropped below the 0 level on November 29, 2019. View odds for this and other indicators: https:// tickeron.com/go/963775 #Dow #stockmarket #stock #technicalanalysis #money #trading #investing #daytrading #news #today pic.twitter.com/adi2GaGlTT"
2019-12-01;1;"Market top? Three of the four major US equity indices have stalled at major pivot points - quarterly and Yearly pivots. See charts. Interesting week ahead! #SPX #DJIA #Dow #RUT #NDX #SPY #equities #stocks #pivot pic.twitter.com/Cl9cbHbUJp"
2019-12-01;2;"Last week model produced 4 SPX and 5 DAX Paths with 3 entry zones hit on SPX and 2 entry zones hit on DAX from which 2 were successful on SPX and 1... Read More ---->>> - https:// mailchi.mp/3fefa9e13f2c/n ewsletter-2538471 … #SPX #DAX #EURUSD #GBPUSD #USDJPY #FTSE #DOW #NASDAQ #USOIL #GOLD #trading pic.twitter.com/YukyMAJW1S"
2019-12-01;0;"Arkadaşlar kanaldaki arkadaşlardan gelen yoğun talep üzerine kanalı gruba açacam. Bir süre daha sinyalleri takip edebilirsiniz. http:// t.me/forextradeanal iz … #fx #forex #forexsignals #fxsinyal #para #money #forextrader #freesignal #dax #usdtry #eurusd #gbp #xauusd #jpy #dow #nasdaq"
2019-12-01;0;"Aktienportfolio jederzeit im Überblick auf dem iPhone. Jetzt GRATIS download. #app #DOW #trade #SMI #DAX #iPhone @Retweet_Lobby https:// itunes.apple.com/de/app/portfol io-aktien-anlagen-im-ueberblick/id1137454363?mt=8&at=11l5GX&ct=twitter …"
2019-12-01;0;"#Boerse #Finanzen #trading #Charts #SocialTrading #DAX #dow #money #performance The new Monthly November factsheets of my #Wikifolio Strategies are ready #investing - all positive ytd and monthly! Check out Next Chance Exodus Trading http:// wikifolio.com/de/de/w/wfexig niti … pic.twitter.com/7PV3Ftghte"
2019-12-01;0;"Portfolio Management für #iPhone . Aktien Anlagen im Überblick (Gewinn/Verlust, Gebühren etc.). #SMI #DOW #ios #nasdaq @Relay_RTs https:// itunes.apple.com/de/app/portfol io-aktien-anlagen-im-ueberblick/id1137454363?mt=8&at=11l5GX&ct=twitter …"
2019-12-01;0;"#DJIA Bullish above - 28100 Stop-loss - 28040 Target 1 - 28160 Target 2 = 28183Target 3 - 28215 Trailing SL - 25 points #DOW #US30"
2019-12-01;0;"Strong NYSE Composite, Dow Jones May Give Bitcoin a Boost Into 2020 @newsbtc #Bitcoin #bitcoin #Dow Jones #NYSE Composite #stocks https:// ift.tt/2sxYL2Z"
2019-12-01;1;"Ons altın analizi şu an telegram sinyal kanalımız da #fx #forex #forexsignals #fxsinyal #para #money #forextrader #freesignal #dax #usdtry #eurusd #gbp #xauusd #jpy #dow #nasdaq #wti #brent #sell #buy pic.twitter.com/O4mMipA40S"
2019-12-01;0;"NordeaMarkets entró corto en el par EUR/USD con un objetivo en los 1.0720 y un stop loss en 1.12.15. #blackstra #trading #trades #Trader #forex #fx #dow #NASDAQ #bolsa"
2019-12-01;0;"Weekend indices update: #DAX 13231 +0.02% #DOW 28075 +0.04% #FTSE 7344 +0.04% #HANGSENG 26332 +0.01% #IGWeekendMarkets @IGSquawk"
2019-12-01;0;"Merry OnLine Christmas Shopping as Black Friday Mall-Shopping Fades No Turkeys -Stocks Fly Help Wanted Why Renting is In & Buyimg is Out #breakingnews @realdonaldtrump #cybermonday #blackfriday #stocks #dow #millennials #realestate #mortgage http://www. linkedin.com/pulse/giserman -group-news-week-ahead-merry-online-shopping-lou …"