date;retweets;text
2019-04-27;1;"How common are pullbacks during a bull market in #stocks ? Levels to watch discussed in video: https:// youtu.be/Tw_ZIk-yo2w?t= 137 … #Dow $ SPY $ QQQ $ DIA"
2019-04-27;0;"https:// buff.ly/2GNjQuT The Dow, S&P, Russell, TSX, and NASDAQ all in record territory. Find out why and what's going to happen in Q2 and beyond. #stockmarket #NASDAQ #DJIA #TSX #Dow #S &P #2019 #2020 #2020Election pic.twitter.com/4PIyOnhvaE"
2019-04-27;0;"Now get signals by Email, SMS, iOS and Android Notifications, Twitter account #fx #forex #cryptocurrencies #bitcoin #scalping #dow #nasdaq #ftse #cfd #indices #index #commodities #trader #trading > http:// fxmgm.com"
2019-04-27;0;"Mystery inventory raises GDP and helps US markets surge on Friday #DOW #NASDAQ pic.twitter.com/JPzqEuKi9X"
2019-04-27;0;"Gracias Evelyn Avila por 37 años de servicio, una gran despedida para un gran ser humano #dow #corteva pic.twitter.com/ILkDCHs2sn"
2019-04-27;1;"Don't miss the decision of the week! Click here to receive BAFFC's full summary of this #5thCir opinion: http:// bit.ly/2todvyU Join #BAFFC to get daily detailed summaries & other benefits: https://www. baffc.org/membership #appellatetwitter #DOW #censorship #FirstAmendment #Facebook pic.twitter.com/uPJILTBFg4"
2019-04-27;0;"One trick pony: predict the market correctly every day. Boring... Still: https:// traderdailydiary.wordpress.com / $ SPX $ SPY #StockMarket #Trading #Markets #SP500 #NASDAQ #DOW #Retirement #Investing #AssetAllocation"
2019-04-27;0;"Not a bad move from 525 to 570 + Blackbox Financial updates: CIPLA Daily Chart https:// blackboxsolutions.blogspot.com/2019/03/cipla- daily-chart-add-to-watchlist.html?spref=tw … #NIFTY #BANKNIFTY #NSE #DOW #RESULTS #SENSEX #BSE #TRADER #STOCKS #CIPLA"
2019-04-27;0;"Weekend indices update: #DAX 12323 +0.08% #DOW 26576 +0.24% #FTSE 7440 +0.06% #HANGSENG 29744 +0.03% #IGWeekendMarkets"
2019-04-27;0;"$ SPX to BO above ATH next week. Trump's V-shape recovery has been very strong. Weekly momentum remains INCREASINGLY BULLISH since early-February and should strengthen on BO. A Double Top is the risk.. #SP500 #DOW #stocks pic.twitter.com/W9sjybWFvm"
2019-04-27;1;"#SP500 closed at a record high at 2939.88 gained 0.47% for the day YTD return 17.27% #NASDAQ closed at a record high today YTD return 22.77% #Dow #DowJones #DJIA gained 0.31% today YTD return 13.79% #stocks #StockMarket #investments #investing #WallStreet #BuildingWealth"
2019-04-27;1;"Still waiting. The S&P came close, but no cigar. Its intraday all-time high of last September 21 was 2940.91 and, today, its highest point of 2939.88 was at the close.1) #stockmarket #Dow #DowJones #DJIA #bullmarket #bearmarket #Fibonacci #ElliottWave #GrandSupercycle"
2019-04-27;0;"【 #NYダウ 】 26,543.33 △0.31% +81.25 [04/26] #令和 #令和最初 #5月7日 #dポイント投資 情報 https:// nikkei225jp.com/nasdaq/ #dow #ダウ #dポイント https:// dpoint-inv.com/portal/top?utm _source=corporate&utm_medium=referral&utm_campaign=dpoint_inv …"
2019-04-27;0;"https:// buff.ly/2GNjQuT The Dow, S&P, Russell, TSX, and NASDAQ all in record territory. Find out why and what's going to happen in Q2 and beyond. #stockmarket #NASDAQ #DJIA #TSX #Dow #S &P #2019 #2020 #2020Election pic.twitter.com/qfWyuXBEyK Checkout this tweet about #luxuryhomes …"
2019-04-27;0;"Walmart (WMT) More: https:// 28signal.com/en/us/WMT/rsi/ 14/divergence/signal … #Walmart #WMT #美股 #dow #stock #trading #rsi #divergence #signal #nyse #nasdaq #invest #investing pic.twitter.com/7PT4ZLYYch"
2019-04-27;0;"New Water Technologie vous présente #Les_bac_a_sel_REGEN + #domestiques_et_industriels . #100L #150L #200L #350L #500L #750L #1000L #1500L #REGEN + #atlasfiltri #filmtec #fleck #bluelagoon #eurotech #canature #seko #idrosal #aukmuller #puricom #dow #veolia #HMdigital pic.twitter.com/7jBPZvngc2"
2019-04-27;0;"Now Trade #Bitcoin #AMAZON #APPLE #PAYPAL #DAX #CAC40 #NASDAQ #dow #ftse #cfd #indices #index #commodities #trader #trading #Volkswagen #VOW > http:// fxmgm.com"
2019-04-27;0;"#DowJones #Dow #Jones #Industrial #Average #StatiUniti #UnitedStates #DJI #US #TradeOnTrading #Trade #On #Trading #Elliottwave #Elliott #Onde #Fibonacci #Ritracciamento #Golden #Ratio #GoldenRatio #Pitchfork #Buy #Sell #Bear #Bull https:// tradeontrading.blogspot.com/2019/04/dow-jo nes-sul-time-frame-giornaliero.html … pic.twitter.com/bhWmOL8r3t"