date;retweets;text
2020-03-04;0;"Yup. You're welcome. Now Check the Dow 's Fri candle you you'll see it was a bull Demark 9 $ DJI https:// twitter.com/steveftw55/sta tus/1235343651062116352 …"
2020-03-04;5;"$ DJI - Dow Jones - If the gap can fill at roughly 28.9k that might set up the next leg down pic.twitter.com/aaXvGYWh9t"
2020-03-04;1;"Strong Earnings $ ANF $ CPB $ AEO $ DLTR $ AAPL $ NFLX $ MSFT $ SPX $ FB $ UBER $ LYFT $ COST $ ADBE $ ORCL $ AVGO $ NVCN $ DJI $ CRON $ ONCY $ MU $ NVDA $ TLRY $ NKE $ NIO $ ACB $ AMD $ GE $ BAC $ F $ AUY $ ROKU $ SNAP $ SINA $ MTOR $ PTON $ ADPT $ LK $ BABA $ WW $ SDC $ NVCN $ AMZN $ FCAU $ TLRY $ AMZN $ OILU $ TSLA $ T pic.twitter.com/trBHIPzwnO"
2020-03-04;0;"It’s different this time! $ DJI $ SPX https:// twitter.com/TaviCosta/stat us/1235310610138746880 …"
2020-03-04;1;"#eurusd X #usdchf #xauusd #algorithm - #markets #GRAMALTIN $ DJI #DowJones #NEOUSDT #ETHUSDT #BTCUSDT #coronavirus #covid19 #SP500 #ger30 #DAX #oil #usoil #bist100 #dolar #altın #viop30 #news #Bitcoin #Ethereum #blockchain #haber #ekonomi #piyasa #forex #varant #TradingView pic.twitter.com/bI8jdsQbbF"
2020-03-04;2;"Talking today's rally in equity markets and what's important to watch after that surprise 50 bps by the #fed yest w/ @EBaker_TDAN on @TDANetwork $ TNX $ SPX $ DJI $ NDX #fed #rates #Covid_19 Catch us every day @11:45 ct for your Market Update https:// tdameritradenetwork.com / pic.twitter.com/4RIewL40AC"
2020-03-04;1;"The Dow Jones has now recovered 50% of last week's Stock Market losses. $ DJI pic.twitter.com/ecHnH5mXwd"
2020-03-04;0;"$ DJI breaking into the 1H Ichimoku clouds and showing an inverse head and shoulders. pic.twitter.com/tCLEz5Mdpa"
2020-03-04;3;"Four of the five largest rolling 5-day point losses in the Dow have come in the past week. On a percentage basis, last week's 12% loss only ranks 34th. $ DIA $ DJI #stocks #dow #correction #coronavirus pic.twitter.com/G5lo9VG5jT"
2020-03-04;0;"$ SPX $ COMP $ RUT $ DJI - all tight inside days so far"
2020-03-04;0;"Made a write up on my views on $ DJI inside http:// elevate-trading.com Looks clean on mobile. Come see what we are about by taking our 7 day trial https:// twitter.com/SatoshiiHeavy/ status/1235102353478406144 … pic.twitter.com/kz1HJPt1iO"
2020-03-04;1;"The $ DJI and $ SPX with exceedingly anemic response to Fed rate cuts on open. Poor prognostic."
2020-03-04;0;"$ DJI Abro este hilo con este índice pero pondré luego resto de índices. Quiero advertir que creo están preparando una tarde de infarto tanto para toros como para osos. Espero una volatilidad en el dia de hoy histórica. Y ahora expongo las razones y el x que. Grafico de 3 días. pic.twitter.com/M6w2idXKxK"
2020-03-04;1;"Stocks wipe out Tuesday's losses ahead of open. 10-Year Yield $ TNX remains near 1% $ SPX $ DJI $ NDX $ RUT Upgrades: $ HD $ CMG $ TGT $ ORCL $ MS $ CRON $ AA Downgrades: $ JWN $ OKTA Watch @TDANetwork for all your Market Coverage, Education and NO politics! 8 am to 5:30 pm ET"
2020-03-04;3;"If you missed $ DJI or $ APPL , there's a play for $ AMZN right now, tick tock! #CryptoIkagi #Stocks pic.twitter.com/XHHIlMFFuH"
2020-03-04;2;"Touch and go. Ichimoku's bearish setup is looking strong. $ DJI pic.twitter.com/2EmCol46ha"
2020-03-04;0;"So do the fed plan on one last pump ? Before the ultimate dump or are we already doomed . Levels im watching moving FWD. Who is brave enough to step in front of this one? $ DJI #stonks https:// twitter.com/SatoshiiHeavy/ status/1235098760834736128 … pic.twitter.com/uYBJFltqL0"
2020-03-04;2;"These stocks soared the most after Biden burned Bernie on Super Tuesday https:// on.mktw.net/32QV1Yt $ SPX $ DJI $ NDX pic.twitter.com/45xgKgws11"
2020-03-04;0;"we have got to quote Dow in points today... should be illegal not to!! #DowJones $ DJI $ SPX @chigrl #investments #investing #stocks #stockmarket"
2020-03-04;3;"Watchout for this technical pattern playing on the 4hr #DOWJONES #DJIA $ DJI #CUPANDHANDLE Targets ~28500 (resistence 27k/27680/28165) Tengan en cuenta el patrón técnico que se está formando en el #DOW 4HR #TAZAYASA Objetivo ~ 28500 (resistencias 27k/27680/28165) pic.twitter.com/UpwNfI0jvc"
2020-03-04;0;"$ HDII Why are you selling if merge is coming? Same with $ SBES ? Any reason why I should stop buying? $ OTC $ ALPP $ GRFN $ SFOR $ SPOM $ AAPL $ MSFT $ AMZN $ FB $ GOOGL $ TSLA $ AMD $ SPY $ DJI $ NYSE $ NSDQ"
2020-03-04;0;"and finally... this usually applies to single assets but there could well be this effect if a legit recessions is triggered. and yes $ BTC is hardly the $ DJI BUT: Warren suggest putting money in the market when his indicator is at 140% is EXTREMELY DANGEROUS. Its over 150% pic.twitter.com/wD0wB2fuub"
2020-03-04;2;"It's important to remember that over the history of the Dow, a 14% pullback from highs isn't all that uncommon, even though it's only happened a couple times in the past decade. $ DJI $ DIA #stocks #dow #dowjones #correction pic.twitter.com/662Mh2eKMT"
2020-03-04;0;"$ MSMY MC Endeavors, Inc/Room 21 Media, Inc. is focused to the manufacturing, marketing, and sells of #Cannabis and #Hemp Products. @frontpagestocks https://www. cbdliquidlabs.com/collections/cb d-gummies-edibles … $ GS $ DJI $ AMD $ NVDA $ TTNP $ IBIO $ SCON $ HTBX $ ICBU $ TPTW $ HDII $ FZRO $ ALYI $ XLPI $ SPOM $ HMPQ $ BIOC pic.twitter.com/p6flQqrB0n"
2020-03-04;1;"Here is the impact (in points) on the $ DJI from some of today’s big movers: $ UNH +224 $ AAPL +41 $ HD +34 $ V +21 http://www. Schwab.com/RandyFrederick"
2020-03-04;2;"$ SAFE (see picture) $ ZM $ ENPH $ NET (picture below) Interesting names with high RS. Especially the last mentioned looks very good. Watching them. For me, it is a still very high-risk environment, 100 % cash. $ QQQ $ VIX $ SPX $ DJI #stockstowatch pic.twitter.com/1eMZEQaVXH"
2020-03-04;1;"3 mins until the NY open, lets see what we get! $ ES_F $ DJI $ NDX $ BTC $ USDJPY"
2020-03-04;0;"$ DJI Dow Jones up over 700 points pre-market, Hmm.."
2020-03-04;0;"Safe to say Wall Street has lost all semblance of sanity. Daily price movements for $ DJI are now more volatile than #Crypto shitcoins."
2020-03-04;0;"$ QQQ $ SPY $ DJI $ ES_F $ YM_F $ NQ_F futures ripping hard on the strong Joe Biden election news. THUNDERCATS HOOOOOOOOOOO #stockstowatch #joebiden #thundercats #futures pic.twitter.com/XliTG75h5x"
2020-03-04;0;"Ca 500pkt upp och vi firar med en kopp kaffe. $ DJI #finanstwitter https:// twitter.com/oskar112233/st atus/1234949339992248320 …"
2020-03-04;1;"#Futures $ SPX +60 $ DJI +565 $ NDX +186 $ RUT +28 $ VIX 27.20 (-) #USDJPY 107.50 (+) #EURUSD 1.116 (-) #USDCNY 6.92 (-) #Oil (wti) 47.93 (+) #Gold 1641 (-) #Copper 2.60 (+) #US10YR 0.95% (-)"
2020-03-04;0;"Futures $ DJI + 400 $ DAX LIVE + 138 $ USD - yuan making dollar weak, eur/usd should rise. Don't trust the $ DJI move.. @Chinavirus making a huge mistake by re-opening factories, virus increases in morbidity on 2nd waves. Billions at risk in Asia."
2020-03-04;0;"Lets see if that help from the FED was enough for a low to be called IMO i just cant see that yet. $ DJI #stonks https:// twitter.com/SatoshiiHeavy/ status/1233584151481081858 … pic.twitter.com/8jNZMj44fL"
2020-03-04;0;"Today: -“Everything was so obvious”. Where were you yesterday? #WallStreet #coronavirus $ dji $ nyse $ spx $ ndx $ vxx $ vix Lol @cnbc telling ppl to buy at sky high. Thank @realDonaldTrump for telling americans to put their earnings in stocks when 12% higher from now #lifeisajoke"